[2025-07-27 11:31:42.694274] BLOCKED: Port Block | Ether / IP / TCP 192.168.29.76:50489 > 216.24.57.7:https FA
[2025-07-27 11:31:42.715053] BLOCKED: Port Block | Ether / IP / TCP 216.24.57.7:https > 192.168.29.76:50489 FA
[2025-07-27 11:31:43.028184] BLOCKED: Port Block | Ether / IP / TCP 192.168.29.76:50489 > 216.24.57.7:https A
[2025-07-27 11:31:43.028955] BLOCKED: Port Block | Ether / IP / TCP 192.168.29.76:50490 > 216.24.57.7:https FA
[2025-07-27 11:31:43.048043] BLOCKED: Port Block | Ether / IP / TCP 216.24.57.7:https > 192.168.29.76:50490 FA
[2025-07-27 11:31:43.228966] BLOCKED: Port Block | Ether / IP / TCP 192.168.29.76:50490 > 216.24.57.7:https A
[2025-07-27 11:31:43.228966] BLOCKED: Port Block | Ether / IP / TCP 192.168.29.76:50391 > 172.64.155.209:https A / Raw
[2025-07-27 11:31:43.259852] BLOCKED: Port Block | Ether / IP / TCP 192.168.29.76:50391 > 172.64.155.209:https A / Raw
[2025-07-27 11:31:43.261111] BLOCKED: Port Block | Ether / IP / TCP 192.168.29.76:50391 > 172.64.155.209:https A / Raw
[2025-07-27 11:31:43.261992] BLOCKED: Port Block | Ether / IP / TCP 192.168.29.76:50391 > 172.64.155.209:https A / Raw
[2025-07-27 11:31:43.261992] BLOCKED: Port Block | Ether / IP / TCP 192.168.29.76:50391 > 172.64.155.209:https PA / Raw
[2025-07-27 11:31:43.261992] BLOCKED: Port Block | Ether / IP / TCP 192.168.29.76:50391 > 172.64.155.209:https PA / Raw
[2025-07-27 11:31:43.261992] BLOCKED: Port Block | Ether / IP / TCP 192.168.29.76:50391 > 172.64.155.209:https PA / Raw
[2025-07-27 11:31:43.261992] BLOCKED: Port Block | Ether / IP / TCP 172.64.155.209:https > 192.168.29.76:50391 A / Padding
[2025-07-27 11:31:43.311492] BLOCKED: Port Block | Ether / IP / TCP 172.64.155.209:https > 192.168.29.76:50391 A
[2025-07-27 11:31:43.311492] BLOCKED: Port Block | Ether / IP / TCP 172.64.155.209:https > 192.168.29.76:50391 A
[2025-07-27 11:31:43.311492] BLOCKED: Port Block | Ether / IP / TCP 172.64.155.209:https > 192.168.29.76:50391 A
[2025-07-27 11:31:43.311492] BLOCKED: Port Block | Ether / IP / TCP 172.64.155.209:https > 192.168.29.76:50391 A
[2025-07-27 11:31:43.311492] BLOCKED: Port Block | Ether / IP / TCP 172.64.155.209:https > 192.168.29.76:50391 A / Padding
[2025-07-27 11:31:43.311492] BLOCKED: Port Block | Ether / IP / TCP 172.64.155.209:https > 192.168.29.76:50391 A / Padding
[2025-07-27 11:31:43.315544] BLOCKED: Port Block | Ether / IP / TCP 172.64.155.209:https > 192.168.29.76:50391 PA / Raw
[2025-07-27 11:31:43.315544] BLOCKED: Port Block | Ether / IP / TCP 192.168.29.76:50391 > 172.64.155.209:https A
[2025-07-27 11:31:43.528687] BLOCKED: Port Block | Ether / IP / TCP 172.64.155.209:https > 192.168.29.76:50391 PA / Raw
[2025-07-27 11:31:43.528687] BLOCKED: Port Block | Ether / IP / TCP 172.64.155.209:https > 192.168.29.76:50391 PA / Raw
[2025-07-27 11:31:43.528687] BLOCKED: Port Block | Ether / IP / TCP 172.64.155.209:https > 192.168.29.76:50391 PA / Raw
[2025-07-27 11:31:43.528687] BLOCKED: Port Block | Ether / IP / TCP 192.168.29.76:50391 > 172.64.155.209:https A
[2025-07-27 11:31:43.528687] BLOCKED: Port Block | Ether / IP / TCP 192.168.29.76:50391 > 172.64.155.209:https PA / Raw
[2025-07-27 11:31:43.594287] BLOCKED: Port Block | Ether / IP / TCP 172.64.155.209:https > 192.168.29.76:50391 A / Padding
[2025-07-27 11:31:44.113474] BLOCKED: Port Block | Ether / IP / TCP 192.168.29.76:50453 > 52.168.117.168:https PA / Raw
[2025-07-27 11:31:44.344028] BLOCKED: Port Block | Ether / IP / TCP 192.168.29.76:50453 > 52.168.117.168:https A / Raw
[2025-07-27 11:31:44.345550] BLOCKED: Port Block | Ether / IP / TCP 192.168.29.76:50453 > 52.168.117.168:https PA / Raw
[2025-07-27 11:31:44.345550] BLOCKED: Port Block | Ether / IP / TCP 52.168.117.168:https > 192.168.29.76:50453 A
[2025-07-27 11:31:44.393607] BLOCKED: Port Block | Ether / IP / TCP 52.168.117.168:https > 192.168.29.76:50453 PA / Raw
[2025-07-27 11:31:44.394398] BLOCKED: Port Block | Ether / IP / TCP 192.168.29.76:50453 > 52.168.117.168:https A
